,review_id,product_id,title,author,rating,content,timestamp,profile_id,is_verified,helpful_count,product_attributes,product_name
356,RRGVO42ZTKYAY,B09HN594TL,5.0 out of 5 stars im in loveeeee <3,DaSchale B.,5,"i’ve been in the market for some quality earbuds and i saw someone do a positive review of these online, so i ordered a pair of these. so imagine my surprise when i got them, and they literally did not have the earbuds in them (lmaooo)i found the jlab support number on amazon and was able to call them, and get the situation rectified within 20 minutes . they were really quick and concise with everything, and they ended up sending me a completely new unit !they’re really cute, and the sound quality is SO GOOD. i listen to a lot of rock and heavy bass music and everything is crystal clear and no weird buzzing from the bass !! there is the tiniest bit of sound that bleeds through them, but i don’t mind that .for the price point and the quality you get, you can’t really beat that !","Reviewed in the United States July 24, 2024",AEBOEHZJW5V3UW7XSDWXH7ZA4CNA,1,0,Color: PinkStyle: Pop,JLab Go Air Pop True Wireless Bluetooth Earbuds
357,R3C1E4RID4SDBR,B09HN594TL,4.0 out of 5 stars Good Enough,Catherine Green,4,"I'm not good at discerning audio quality, but these earbuds are ever so slightly worse quality than my expensive headphones. But like for the price, that's to be expected. They're good enough for when I don't want to use the bulky headphones.They also don't have a great range. They'll be fine if I walk across the room, but if I start going behind objects or down a hallway, the sound will start to skip a bit. But again, they're fine enough for the price. If you use them with your phone and carry it with you, they'll be fine.I saw someone else say these made their ears itch. Mine itch a bit while using these too, but my ears are sensitive. I only use 1 earbud at a time anyway, so I just switch them out for the other ear when it starts to get itchy after an hour or two. I think that might just be earbuds in general that do that, but I like that I can easily switch them out.I really like that they automatically connect when you remove them from the case, you don't have to turn them on. If they don't detect any paired devices, they automatically enter pairing mode which makes them super easy to use.The magnets in the case are strong and it's a bit hard to take the earbuds out sometimes.For the price, these are great. I hope they last me awhile.Edit: After 2 months, I still like these earbuds. I rarely have to charge them. Occasionally while using them with my TV, the audio starts getting choppy. Putting the earbuds back into the case to disconnect them, then taking them out so they automatically reconnect again seems to fix the problem. Again for the price I think they're adequate for me.","Reviewed in the United States June 4, 2024",AFK53FA6BDBFPTFOUT66CQ4QLIFQ,1,2,Color: My Little PonyStyle: Pop,JLab Go Air Pop True Wireless Bluetooth Earbuds
358,R2QJSRB54ZYBW6,B09HN594TL,5.0 out of 5 stars Durable!,Kim Bueche,5,"OMG! Not only do these things work amazingly but they are super durable! My husband, halfway through a load of laundry started freaking out because he could hear the tink tink noise of his earbuds that were left in his pocket in the washing machine. I stopped the machine and drained the water enough to pulled them out from the bottom of the machine as they are literally completely submerged in water. Took a paper towel wiped them off and they hooked back up and have been working for the past few months just fine! Definitely would recommend for any buddy who is either forgetful or any men that work in construction that need Bluetooth earbuds to make phone calls or listen to music while they’re driving machinery.","Reviewed in the United States July 30, 2024",AEA4MCT6BO4YS7VUV3P2AQ7JXGOA,1,0,Color: BlackStyle: Pop,JLab Go Air Pop True Wireless Bluetooth Earbuds
359,R379UT9VXHPGIC,B09HN594TL,5.0 out of 5 stars So happy!,Kathryn Ashley Childs,5,I was so skeptical about buying these because of the price. Being an Apple and tech snob I thought there is no way these could be great like all the reviews said. My AirPods quit working after a few years and at the time I wasn’t wanting to shell out hundred or more dollars for new ones. I ordered these to wear around the apartment while I clean and when I exercise at the gym. I got them in the mail very fast. When they came I fell in love with the lavender color so much I’ve tried to make it my new signature color for everything lol They are beautiful not only in color but also design. I was being kinda bummed about it having an attached USB cord but once I started using them it has become one of my favorite things about them. When I turned them on and added them to my iPhone fairly quickly and they continue to connect without any issues. Super easy. They fit amazing and come with different size ear pieces. The sound quality for the price that I paid is outstanding. They aren’t completely as loud as probably more expensive brands but I can definitely afford new AirPods Pro’s but I have remained more than happy with these and they have lasted me for longer than I thought and saved so much money. Love them!,"Reviewed in the United States June 22, 2024",AHW3OKU5QR7MTRTVL5JNHMFJPKIQ,1,0,Color: LilacStyle: Pop,JLab Go Air Pop True Wireless Bluetooth Earbuds
360,R25J1ES8TJIMUL,B09HN594TL,5.0 out of 5 stars Great earbuds for the price.,David,5,"I've bought like 5 of these already. Not because they broke or got lost or anything like that. I've got one stashed in my car, my backpack, two of my jackets and one for my PC. They got good sound, but if you're an audiophile you might wanna look elsewhere. I usually use one earbud when walking around or doing chores, so that lasts for a few hours. If I feel like that battery is gonna die, I switch earbuds. I never have to worry about battery life. If anyone is wondering what the difference is between the Black and Midnight colors are. They are basically the same. Midnight is like 5% lighter than black. You won't notice till you put them side by side. The transparent case one is just the coolest thing ever.","Reviewed in the United States July 24, 2024",AHKISFGRHS23S5AEGLKBGXU6Y5GQ,1,0,Color: ClearStyle: Pop,JLab Go Air Pop True Wireless Bluetooth Earbuds
361,R36SPN2A5XX8MY,B09HN594TL,4.0 out of 5 stars Too large for smaller ears,LoPas,4,"I read reviews saying these were good for small ears but I have not had the same experience. I cannot get these to comfortably fit and stay snug in my ears despite trying all the pad options. I currently use airpods but those often pop out when I smile so I was looking for something more snug.I love the color and sleekness of the case but they leave a lot to be desired. Sound quality it OK. I am used to airpods stopping whatever is playing when removed from your ear. These don't do that so every time you remove it to have a conversation or it falls out, your audio keeps playing. Also, if you need to adjust the buds in your ear, you will likely hit the track forward or back button.They are certainly more affordable than many options but I will keep looking for something with a better fit.","Reviewed in the United States July 12, 2024",AGUXWV4NA7IQZR5PNJ5VPRZFNQTA,1,0,Color: VioletStyle: Pop,JLab Go Air Pop True Wireless Bluetooth Earbuds
362,R2JPOBGQH4AMRH,B09HN594TL,4.0 out of 5 stars 5V 1A Charging,Kindle Customer,4,"Overall I like the product.I started using then when I found a pair in my stuff after movingThe sound quality is better than I would expect for less than $30, so I bought a new pair when one of my earbuds slipped out and fell beyond my reach.The battery life is phenomenal, because I just used it for the past couple of weeks without actually charging it.I plugged it in every night to my USB-C wall block, not realizing that the case is limited to a 5V 1A connection. It's in the documentation, it's my fault for not reading closer, but the case will not charge if you plug it in to fast charger.In my defense your older case that used USB-A was compatible with 5V 2A chargers.","Reviewed in the United States July 20, 2024",AGIN4X7CJPH3SLUHFODLVSMNECVQ,1,0,Color: TealStyle: Pop+,JLab Go Air Pop True Wireless Bluetooth Earbuds
363,R200L60X34K5RI,B09HN594TL,5.0 out of 5 stars The first set of EarPods that cost less than 100 bucks and sound worthy,Kaila,5,"I absolutely love the sound quality of these AirPods and the ease of use. I love the fact that the case has a built-in charger, so I’m not having to attach one more thing, I can just plug and go. The best part is that the case holds such a great charge that I really don’t have to plug it in often. Same with the AirPods in itself, they hold a really great charge quality and fit perfectly in my ear. I use Them daily when I go for walks in the gym or in my car on the road. I definitely recommend these.","Reviewed in the United States July 28, 2024",AGBC5QYUOG4UGUM4MFXAE26V4DFQ,1,0,Color: SlateStyle: Pop,JLab Go Air Pop True Wireless Bluetooth Earbuds
364,R3URZSBMZ2QIYF,B09HN594TL,4.0 out of 5 stars Good for the Price,April M.,4,"I lost one earbud of the same brand while doing yard work. I saw these that were the same brand and smaller in size, which I needed for my smaller ears. Sound quality is great. Pairing to my phones and speaker is easy. I love the new flip top lid! The only issue it that they seem to lose connection when in use. The music will cut out in one ear or both at random times. And sometimes not at all even though my phone/speaker is in arms reach. The range distance is not as far as my last pair, but for the price, not bad. Also, I got the lilac color so it is easier to see in the grass when dropped!","Reviewed in the United States July 17, 2024",AFDPWPD72TCCAUHNTVKBC5TNIAEQ,1,0,Color: LilacStyle: Pop,JLab Go Air Pop True Wireless Bluetooth Earbuds
365,RP1YA08URO2QW,B09HN594TL,4.0 out of 5 stars Great value for the price point,Jim,4,"I bought these when I couldn't find my airpods.Pros: Good fit. Great sound. Great bang for the buck. Great battery life.Cons: if you have short fingernails, they are a struggle to get out of the case. They have a tendency to drop connection with each other and you have to delete them from Bluetooth, tap each 7 times quickly, then reconnect. No USB port. Just a 2"" cable built into the case which is annoying if you have your charging brick plugged in somewhere not easily accessible. I usually get long cables from an outlet behind my bed.Overall, despite the little quirks, they have better sound than my airpods. For the price and sound quality, would buy again.","Reviewed in the United States July 12, 2024",AENWKMMDZVNLH4P646K3PBGLQQ2A,1,0,Color: BlackStyle: Pop,JLab Go Air Pop True Wireless Bluetooth Earbuds
366,R3MBVQX9DXWI81,B09HN594TL,5.0 out of 5 stars Surprisingly good!,SJT,5,"I wasn't sure about how well these would be, given the price, but I needed something I could use while I wait for my helix piercing to use. I normally use airpod max, so I'm used to a pretty good noise cancelling and generally good sound quality. I however, really enjoyed these headphones! The battery life has been amazing and they were super easy to set up and figure out controls. The noise cancelling works pretty well, but I will say I haven't used it in that busy of places. Sound quality is also really good for the price. I would highly recommend if you need earbuds and don't care for the price of airpods or other similar things.","Reviewed in the United States July 21, 2024",AEZOEZ3UMPYXEUKBVCOXMCYG45DQ,1,1,Color: BlackStyle: Pop,JLab Go Air Pop True Wireless Bluetooth Earbuds
367,R304UVGAUYRWTW,B09HN594TL,5.0 out of 5 stars Awesome Earbuds - Fast delivery,J W.,5,"Work very well, paired seamlessly with my computer and/or android phone, easy to charge when not in use and can pre-charge the case so earbuds will charge when put away for the night (etc). The fit is good and there are additional ear piece adapters included in the order. All-in-all I am very satisfied with this purchase - the price was good, the quality is very good, ease of use is great, and delivery was fast. No complaints at all.","Reviewed in the United States August 2, 2024",AEHMEXMQYOESPEPTHI3XYGPPI3EQ,1,0,Color: BlackStyle: Pop,JLab Go Air Pop True Wireless Bluetooth Earbuds
368,R26U4PE9H7E0J7,B09HN594TL,5.0 out of 5 stars Fantastic sound and I love the color,Jennifer,5,My son’s AirPods broke so he swiped mine. I wanted a cheaper option and a fun color and I found everything I was looking for in these! They fit so nicely in my ears and blocked out background sounds better than my AirPods. And for this price!!! Mama loves a good bargain. Medium size banana for scale- probably would have been better to take a pic of my medium sized ear for scale but had reservations in case people have an ear ick (not that my ears are icky)!!!,"Reviewed in the United States July 29, 2024",AGZAGYFG5WCWHONP7EL54XJZ7UBA,1,0,Color: TealStyle: Pop,JLab Go Air Pop True Wireless Bluetooth Earbuds
369,R21J4NXLYQLE59,B09HN594TL,4.0 out of 5 stars Love these!,Alyson Coley,4,"I got these for my Galaxy S24. I tend to misplace my earbuds all the time so I have multiple pairs. I can hear everything well and when I'm on the phone, others can hear me fine. I have small ears and they fit my ears great. I also love that the USB charger is built into the case as it makes it super convenient to charge just about anywhere. Let's not forget that they're PURPLE!!! 😁😁😁They get 4 stars because when I press them to end a call or pause a music/video, it doesn't work and I have to do it manually on the phone.","Reviewed in the United States July 20, 2024",AFMQIDXZRVAK6TKT6ODTHFUSXGMA,1,0,Color: LilacStyle: Pop,JLab Go Air Pop True Wireless Bluetooth Earbuds
370,R1M2D1QY4QPUM5,B09HN594TL,4.0 out of 5 stars Pretty good,Lilly,4,"I really liked it. Especially compared to my other earbuds that only last 2 hours... Charges quickly and keeps charge.I like the easy function taps, but there are a bit to remember.The built in charge cord is a tad bit inconvenient for me, only because its more difficult for me to plug into a charging block (and my comp tower is on the floor with inadequate access points) than plug in a charger at work.","Reviewed in the United States August 2, 2024",AFOOSXZGOFA6MT5WH3PTX5RJ7HXA,1,0,Color: ClearStyle: Pop,JLab Go Air Pop True Wireless Bluetooth Earbuds
371,R3O74B3UV5SAJS,B09HN594TL,4.0 out of 5 stars Small for fat or normal fingers,The dude,4,"Sound quality or pretty clear, loud enough, easily paired to my phone. The case is very small which made it kinda hard to grab the ear buds. Lol something I didn’t think about when I preferred them. Also it could it very easily be missed in a big purse or backpack if you aren’t careful. Overall good purchase for the price since I got them for sale and I actually wanted something more compact.","Reviewed in the United States August 2, 2024",AFG2WM6VJR4GAIOLMPAJ75BEOJIQ,1,0,Color: BlackStyle: Pop,JLab Go Air Pop True Wireless Bluetooth Earbuds
372,R2W1EOUYBCBZQ,B09HN594TL,5.0 out of 5 stars Works great,Cory,5,"i had them for a couple months before rhey fell out of the case and i didnt notice then they got ran over and one of them still works actually so i must say they are good quality, the buttons are nice, they sounded nice together before the other one died from getting ran over, the earbuds them self were a little bit bigger than i thought but the case was sleek and they worked well","Reviewed in the United States August 2, 2024",AEHNM4ORUFZXVGKXC33MCMJOI6MQ,1,0,Color: BlackStyle: Pop,JLab Go Air Pop True Wireless Bluetooth Earbuds
373,R2XZNZ15GZOWSB,B09HN594TL,4.0 out of 5 stars Great ear buds for the most part,Gayle,4,"These are great. They connected to my iPhone without much difficulty. I hardly had to do anything to get them to pair! The only con is when you are using them for a phone call, they tend to switch back to the phone and I can’t hear the conversation! I have to go and connect them back to the earbuds to hear the phone conversation!","Reviewed in the United States July 31, 2024",AFUBDUUGEET3GDSDGWN3T7IEW3BA,1,0,Color: SlateStyle: Pop,JLab Go Air Pop True Wireless Bluetooth Earbuds
374,RXOI11YYPWBI5,B09HN594TL,5.0 out of 5 stars Great Product for a Great Price,Amazon Customer,5,"I love these earbuds! They last longer than a very popular name brand pair I have. There are options for the tip to make sure you get the best fit for your ear. One of the features I like best, and it may seem silly, is the charging cord is attached to the earbuds so you don't have to remember to have a charging cord for them - you just need a usb port. I definitely recommend buying these!","Reviewed in the United States July 28, 2024",AEAGTXAXL6YZ46XEJH7EUI6TUWOA,1,0,Color: BlackStyle: Pop,JLab Go Air Pop True Wireless Bluetooth Earbuds
375,R1H8YO6OJWWG8N,B09HN594TL,"5.0 out of 5 stars Good sound, easy charge",Matt,5,"These are a great option. They fit well and stay in place fairly well. The sound is good. Also, the built in usb cable is brilliant. I don’t have to look for a cord when they need a charge, just a port. The charge lasts for at least a couple of days with pretty heavy use. The only knock- I can’t wear them for running/bike riding as they don’t always stay perfectly in place. Overall, they were much better than I expected for the price. The color options are fun!","Reviewed in the United States July 25, 2024",AHAPD3HTY62K6CGMEF4M57RZ24NQ,1,1,Color: RoseStyle: Pop,JLab Go Air Pop True Wireless Bluetooth Earbuds
376,R25IXUC6NHTTN8,B09HN594TL,4.0 out of 5 stars Pretty Good,ravenjanee1,4,So far so good I purchased these to replace my AirPod pros. These so far are a great alternative and hundreds of dollars cheaper. I do own the AirPod max headphones but working in an office I need an in ear and these are it. Love that I get all the same features for a good price. And I’m not mad at the sound quality. I did tweak the settings a bit on my iPhone but it’s really great for the price point. They also fit great in my coach AirPod max case so that’s a plus.,"Reviewed in the United States July 10, 2024",AFVYEKFXZEOSUB3F6RZUZS4D6DHA,1,0,Color: LilacStyle: Pop,JLab Go Air Pop True Wireless Bluetooth Earbuds
377,RWGK2LHK5F8V1,B09HN594TL,5.0 out of 5 stars Better than GalaxyBuds,jahn mcgeary,5,"I've had these Jlab earbuds for about 5 months now and all I can say is, WOW! I bought them for a cheap work walk alternative to my $150 Galaxy Buds. I had no idea I would start choosing the Jlabs almost every time after. They are just betterBattery life is super ridiculous long. I sometimes feel like I have magic pods since they live at 100%. I charge the case super infrequently and mostly because I feel ashamed I haven't in so long.I wear them: cooking, cleaning, doling laundry, mowing, watering the garden, walking at work breaks, trail walking, in bed before I fall asleep playing books, etc.","Reviewed in the United States July 10, 2024",AFTAMPT2AFPCQXHMXXP3GEN4AZXQ,1,0,Color: SlateStyle: Pop,JLab Go Air Pop True Wireless Bluetooth Earbuds
378,R17IS4V03YMRKE,B09HN594TL,5.0 out of 5 stars Sleek and Compact,Rebecca,5,"I was genuinely surprised at how small this device was. Small and sleek design is easy to carry with you on the go. It can fit easily into your pocket or even in a small pocket of a purse. Sometimes, you don't know you are even carrying them with you. The magnets keep the buds securely inside and the audio is just perfect. I use this on my laptop and my phone and these earbuds have been amazing.","Reviewed in the United States July 25, 2024",AEMCJND7B6IXKKZX4FZDS3S5NCDQ,1,0,Color: VioletStyle: Pop,JLab Go Air Pop True Wireless Bluetooth Earbuds
379,R38QAOU69N8CXC,B09HN594TL,5.0 out of 5 stars Must Buy,Alexandra Radford,5,I bought these to replace my old ones and I'm glad I got these. Great for price and I love the fact that the charging cable comes built into the case. So I don't even have to worry about carrying around a charging cable with me just in case. I love the slim design. Its not bulky and it fits comfortable in my pocket.,"Reviewed in the United States July 30, 2024",AFAMUXAROSI3LDSHORXU5G3QXQ6Q,1,0,Color: MidnightStyle: Pop,JLab Go Air Pop True Wireless Bluetooth Earbuds
380,R23DM3ST57SU31,B09HN594TL,5.0 out of 5 stars Very awesome sound quality,Amaris G.,5,"I really really like these, they’re super easy to “set up,” and i love the way they look. They fit very well in the ear and the touch controls are pretty neat. I think one of my favorite features is the “be aware” mode where you can basically turn off the sound cancellation and be aware of your surroundings. Speaking of which, the sound cancellation is great! i can’t hear anything besides my music playing when it’s on. The quality of the audio itself is really really good—a huge upgrade from my previous earbuds. The bass is great and the sound’s pretty crisp and clear. All in all, i’d give these a 9.5-10. I’d definitely recommend them!","Reviewed in the United States July 7, 2024",AEO3F7A56JW2WGY5ESBAETCO6OSA,1,0,Color: Fruity PebblesStyle: Pop,JLab Go Air Pop True Wireless Bluetooth Earbuds
381,R28SS177K3ZMXW,B09HN594TL,5.0 out of 5 stars Good sound quality and decent battery life,Charles Rockwell,5,These have a few options to choose for sound quality. The bass boost seems to work well with no distortion. Battery life has exceeded 8 hours with every day use. The controls are intuitive and easy to use. I like the fact that the charging cord is integrated into the case. You never have to worry about where the cord is. There are 3 sizes of silicon buds so finding a size for your ears should be easy.,"Reviewed in the United States July 23, 2024",AE4AE6YAWL6J4TNPLHCI4CGO356Q,1,0,Color: Fruity PebblesStyle: Pop,JLab Go Air Pop True Wireless Bluetooth Earbuds
382,RU3CAC4738LZ3,B09HN594TL,5.0 out of 5 stars They work…,tori,5,"So I bought these in August 2023 and it’s now June 2024…when I tell you these have been use EVERY single day, I’m not kidding. Great sound, easily chargeable and I’ve never had a pair of headphones for this long. I use them with my iPhone 14+ and they work great and the color is cute. One thing I will say is since I use them every day, cleaning them is a must. The speaker screen has fallen off a couple times but I am able to place it back correctly after cleaning and put the ear bud back on. Also the longer you use them the faster you have to recharge them every night, but for the first 6 months I could go days without charging, but again I use them every day so maybe they’re just getting old. I love these, and will buy another pair whenever they choose to stop working but still going strong!","Reviewed in the United States June 19, 2024",AFDEWTFOIXL3G5BGIT4W4NDYS2UQ,1,1,Color: LilacStyle: Pop,JLab Go Air Pop True Wireless Bluetooth Earbuds
383,R1L6JPU0TUM33X,B09HN594TL,5.0 out of 5 stars Great Sound and Stay PUT!!!,William Hoehlein,5,I bought these to replace a pair of Bose earbuds. The Bose would NOT stay in my ears especialy during any activity. These JLab Go Air Pop True Wireless Bluetooth Earbuds stayed in my ears while cutting grass and doing yardwork. They also blocked out the majority of the lawnmower sounds. The music was clear and the bass was full without being overbearing. I highly recommend these earbuds!!!!,"Reviewed in the United States July 28, 2024",AG6VJZSFAVOGJGQQUBTDG7B32ZRQ,1,0,Color: BlackStyle: Pop,JLab Go Air Pop True Wireless Bluetooth Earbuds
384,R2B6ZEVUINRXKF,B09HN594TL,5.0 out of 5 stars The best!!,Amazon Customer,5,"These are amazing!! I had some others that were okay, but the sound quality and sound proofing is really good. I LOVE the color and the fact that when they came in, they were fully charged and I used them everyday for almost two weeks straight before it told me that my battery was starting to get low. If you are looking for a really good and affordable headphone, these are excellent.","Reviewed in the United States July 26, 2024",AHQTWD4NJCI7GSBOCPW6ZE7O7KIA,1,0,Color: SlateStyle: Pop,JLab Go Air Pop True Wireless Bluetooth Earbuds
385,R3PNG5FYHXTW0Q,B09HN594TL,5.0 out of 5 stars Love these,J P,5,"This is my second pair. I lost the right one of my previous pair, and then the left. (Oye) I have been wanting to get a replacement pair, and finally did when there was a slight price drop. Wahooo back in business!!Also: we first found out about these from some friends who were raving about them. My wife also has a pair-- we are obsessed.","Reviewed in the United States July 28, 2024",AF5MVD5NM4XD4K32ND4LPDXZJLVQ,1,0,Color: LilacStyle: Pop,JLab Go Air Pop True Wireless Bluetooth Earbuds
