,review_id,product_id,title,author,rating,content,timestamp,profile_id,is_verified,helpful_count,product_attributes,product_name
194,R1A9WN485EBEF2,B09H27SXHS,3.0 out of 5 stars Son livianos,Douglas Montes,3,Muy buena,"Reviewed in the United States May 17, 2022",AHKRWNMNIL2STGH4ANTYZSGGIMAA,1,0,Unknown,HTC True Wireless Bluetooth Earbuds 2
195,R10CUBL1EWADQW,B09H27SXHS,3.0 out of 5 stars Good sounding headphone but left bud won't charge at all,Vincent,3,I get the luck of having a faulty left bud/charging port,"Reviewed in the United States December 1, 2021",AF6EUGOAOXWWMFTZQHEASZF4ANZQ,1,1,Unknown,HTC True Wireless Bluetooth Earbuds 2
196,R25G8B5MOAKT2Q,B09H27SXHS,5.0 out of 5 stars Nice!!!!😎,The Indian Chief,5,"I've owned several sets of earbuds, this one beats them all hands down!! Very good sound quality, especially in the bass response category! Also very comfortable to wear, and no slippage!","Reviewed in the United States January 9, 2022",AGEGH7PY764OYYHMDYQD3FFKUNDA,1,0,Unknown,HTC True Wireless Bluetooth Earbuds 2
197,R3JLFY6TBRAIU2,B09H27SXHS,5.0 out of 5 stars Cheap but good,Amazon Customer,5,Not expensive. Sound quality is good. This is my second day wearing them and they hold a good charge and very comfortable to wear,"Reviewed in the United States April 19, 2022",AFDYJP6JQQ7L7JWU3WLZAPX5OA2A,1,0,Unknown,HTC True Wireless Bluetooth Earbuds 2
198,R3TOVO6X98PW91,B09H27SXHS,"5.0 out of 5 stars They are perfect, they sound incredible, amazing battery:):)",Hernan Palma,5,"I had some problems at the beginning, the seller sent me a replacement immediately and they work perfectly","Reviewed in the United States July 5, 2022",AGDDLKITNBRKXJEERO3IYWVDZQEQ,1,0,Unknown,HTC True Wireless Bluetooth Earbuds 2
199,R3OA8TK890MMO6,B09H27SXHS,2.0 out of 5 stars unreliable,Michael,2,not even 6 months and the left side won’t charge anymore,"Reviewed in the United States February 25, 2023",AGTV2ELWEQGXZ4IAIC22Y47K4FMA,1,0,Unknown,HTC True Wireless Bluetooth Earbuds 2
200,R5Q1SPE8H056D,B09H27SXHS,2.0 out of 5 stars Bad ergonomics. No longer makes sounds after 1 month of light use.,Bubblechaos,2,The fall out of ur ears so often. I can still use the touch sensor to skip and both ear buds pause music. But there is no longer sound on both earbuds. Nothing works.,"Reviewed in the United States May 16, 2022",AEGSNFQGQIPYQ6L67D5HEEXLNJBQ,1,0,Unknown,HTC True Wireless Bluetooth Earbuds 2
201,R5Y7S8SPJKZSO,B09H27SXHS,2.0 out of 5 stars Problems after a few months…,Matt Tolleson,2,"Worked great for a few months, then started to cut out. Sounds good when working…I’m hoping they send replacements, I’m not sure if they will, it’s very obvious they barely know English. I will update if the new ones actually ship.","Reviewed in the United States January 30, 2022",AE74TKH6LUJT4OGRNBKKMR5IVTAA,1,0,Unknown,HTC True Wireless Bluetooth Earbuds 2
202,R2H0G95FL5667V,B09H27SXHS,5.0 out of 5 stars Bang for your buck 💯,John Ardoin,5,Louder and deeper bass than Air Pods. Great battery life. Small container.,"Reviewed in the United States July 18, 2022",AG4X2H7U2JEQYNDCBBFPBZCNIFBA,1,0,Unknown,HTC True Wireless Bluetooth Earbuds 2
203,RZT98XZ9YFO4H,B09H27SXHS,5.0 out of 5 stars Great little earbuds,Kenneth Peterson,5,These have exceeded my expectations for budget friendly ear buds!,"Reviewed in the United States August 19, 2022",AECRHF6UKPZPSWGBIUYITRICQSPQ,1,0,Unknown,HTC True Wireless Bluetooth Earbuds 2
204,R2P1X36CQGOZYT,B09H27SXHS,1.0 out of 5 stars Worst earbuds ever,Regine Dominique,1,"Those are the worst earbuds i ever use in my whole life. After charging them , i tried the pairing with my phone , it took me more then 30 mns to finally “discovered” them. After only on gave sound the other was connected but no sound was given. Right after i contacted amazon to proceed a refund , they said only after receiving the item. These companies have 0 respect for customers. U sent me a damage accessory and you think i’m gonna keep it. Like if take two weeks to receive the garbage they sell me i ll find my money in two weeks too.","Reviewed in the United States March 2, 2022",AGWKSYEGWUYL4ND4MTVLSS36F7IQ,1,0,Unknown,HTC True Wireless Bluetooth Earbuds 2
205,R1727QBIB9N6BG,B09H27SXHS,5.0 out of 5 stars Excelente auriculares tienen buena calidad y duración de batería,anthony flores,5,El artículo esta excelente tiene buena calidad de sonido y la duración de la batería es excelente muy recomendable,"Reviewed in the United States March 31, 2022",AEPPZBIVXXKP34TIXGOLXXYW4MSQ,1,0,Unknown,HTC True Wireless Bluetooth Earbuds 2
206,R2AG8TRXZBISU7,B09H27SXHS,5.0 out of 5 stars Exceptional,Chris,5,"Overall compact packaging , ergonomic charging case . Sound quality is great . Very satisfied , no regrets .","Reviewed in the United States March 25, 2022",AGPEQXYNB2PP4OI5VMQKSBMENV7Q,1,0,Unknown,HTC True Wireless Bluetooth Earbuds 2
207,R1LYHLAGQNZ8Z3,B09H27SXHS,1.0 out of 5 stars Good sound quality but 1 big problem,Joshua Laird,1,"The sound quality when they're working is great for 25$ earbuds. But my right ear bud is constantly being disconnected for no reason. It happens every time I use them. I stopped using these 1 day after I got them because it's so irritating. After it disconnects randomly mid song, it just makes a beeping noise till you put it back in its case with the other one. Then take them out they both connect and 1 minute later the right earbud disconnects again. And they are both fully charged and the case too. I am dissapointed by an HTC product","Reviewed in the United States February 28, 2022",AHENQJDEGAZ37URNEQQK4BQWDESA,1,0,Unknown,HTC True Wireless Bluetooth Earbuds 2
208,R126Y2OGSB524Q,B09H27SXHS,5.0 out of 5 stars Great headphones,Jonathan Colston,5,I so love them. They are very good and I can hear just about everything,"Reviewed in the United States March 28, 2022",AG2KYYDBIETR34P6GKZ32UK7BM7A,1,0,Unknown,HTC True Wireless Bluetooth Earbuds 2
209,RYR6RJHOV9O9B,B09H27SXHS,1.0 out of 5 stars Low audio volume,Amazonian,1,"The audio quality on the device is ok but the max volume on the buds is very low. I tested these on multiple devices and compared them to an even less expensive set of Anker buds to compare the volume level. If my phone was on ""10"", the Anker's played the audio at ""10"", where the volume on the HTC Earbuds was at a 5. Compared with Samsung headphones as well and same results. I tried to return these buds but missed the return window.They are lightweight and comfortable but that is all they have going for them.","Reviewed in the United States February 11, 2022",AGAY5CC3KUAYC4CCNL4EIEAQ33ZQ,1,0,Unknown,HTC True Wireless Bluetooth Earbuds 2
210,R1RRAROYGH5G7T,B09H27SXHS,5.0 out of 5 stars Decent,Pacheng  Vang,5,Love everything else but not the fit. It's just not that comfortable.,"Reviewed in the United States May 20, 2022",AEAJ7RHX3K7EV46QSTLWEI46UVPQ,1,0,Unknown,HTC True Wireless Bluetooth Earbuds 2
211,R15VP4AH1AI32Y,B09H27SXHS,1.0 out of 5 stars Barely used and no sound from the left,V-Potter,1,"These are uncomfortable and don't stay in place. This is a problem because touching it to readjust it means I have to go to my phone and manually go back to where I was in my audio book.The left side no longer has sound. It is connected and when I touch it, it triggers the controls. It doesn't do what it is supposed to but it does some random thing.I have tried all trouble shooting suggestions and concluded the product is junk.","Reviewed in the United States June 12, 2022",AEAGB7EVCRUAQXNIGCK3NLNDQAEQ,1,0,Unknown,HTC True Wireless Bluetooth Earbuds 2
212,R7BKYA01YMOM,B09H27SXHS,5.0 out of 5 stars 2 pairs only left side works horrible,Mike,5,Got 2 pairs only one side works even after reset....,"Reviewed in the United States June 9, 2022",AEDMCRO44HLKH5NEJ2RXSOT4PPLA,1,0,Unknown,HTC True Wireless Bluetooth Earbuds 2
213,R1MAG79QWI6CWR,B09H27SXHS,5.0 out of 5 stars Good customer service from HTC,jesse v.,5,HTC reached and replaced my buds. Replacements are great. Thank you,"Reviewed in the United States April 29, 2022",AHORTQEGMDCNYNN5MZADMCCMXKQA,1,0,Unknown,HTC True Wireless Bluetooth Earbuds 2
214,R2KMBO7ZVHVP5T,B09H27SXHS,5.0 out of 5 stars Nice Earbuds,Kirk Benson,5,So far so good these earbuds are comfortable and good no background noise another plus is the sound is pretty good.,"Reviewed in the United States December 6, 2021",AFGBCEFRGKBAYASP7SN73KMGXLNA,1,1,Unknown,HTC True Wireless Bluetooth Earbuds 2
215,R22N35UQIWB27O,B09H27SXHS,2.0 out of 5 stars Faulty manufacturing,Joseph Maitre,2,"Product stopped working ordered replacement. They work fine.. preset good actually, but overall the hassle n time to replace so that took away some points.","Reviewed in the United States March 17, 2022",AGIF3C7UIW2PP5N5ZHX6QYLQW7IQ,1,0,Unknown,HTC True Wireless Bluetooth Earbuds 2
216,R13N42U7AH771O,B09H27SXHS,5.0 out of 5 stars These are better then everything else I've gotten,Dwayne,5,Better then apple headphones AND my bose,"Reviewed in the United States June 21, 2022",AHTVEJZSVYZE7IR5FU4UZMGYXUZQ,1,0,Unknown,HTC True Wireless Bluetooth Earbuds 2
217,R37QFLG4IJJWG1,B09H27SXHS,1.0 out of 5 stars Annoying piece of tech,Alistair Schneider,1,They fall from the ear. When they pop out the ear you push them back in they go on mute. They dont connect easilly automatically to things like computer. A stupid piece of device. Stopped using them after 2 days. Buy more expensive in the end it will be cheaper for you and less annoying. Engineers who develop these things need ti test with real humans and not fall in love with their tech complexity. Complexity is not cool. Sorry. A bad purchase for sure.,"Reviewed in the United States December 6, 2021",AFRSQIODEZPWHGO2HQPRTEGKNOGA,1,1,Unknown,HTC True Wireless Bluetooth Earbuds 2
218,R1EH673E79A0VE,B09H27SXHS,5.0 out of 5 stars Good quality low price !,Gabriela Allred,5,Good quality and low price,"Reviewed in the United States May 14, 2022",AHYQR26BOG7YWGOXJCG2WNH6Z5OQ,1,0,Unknown,HTC True Wireless Bluetooth Earbuds 2
219,R2ISI3S6BPE2RR,B09H27SXHS,5.0 out of 5 stars Just what I was looking for. Nice quality and very durable,TREMELL T COOPER,5,Just what I was looking for.,"Reviewed in the United States April 11, 2022",AHWVJVFTQX5WMONC7N4YZCRYC77Q,1,0,Unknown,HTC True Wireless Bluetooth Earbuds 2
220,R36UWZGX8DSIDX,B09H27SXHS,"1.0 out of 5 stars Poor range, sound constantly cuts off, one pair died after a month",Chris Barley,1,If you walk more the a couple feet from your phone they start cutting out. I bought a second pair because I thought I lost my first one. The second pair died after a month just outside the Amazon return window. Also just sitting there listening sometimes they just cut in and out like they are out of range.,"Reviewed in the United States August 11, 2022",AH4JKQPZ7NJMH2X33TJU74OWDOHQ,1,0,Unknown,HTC True Wireless Bluetooth Earbuds 2
221,R1BXQF8EHEJ3WR,B09H27SXHS,5.0 out of 5 stars Simple and good quality,Amanda D,5,Best bang for your buck. Surround sound quality is perfect.,"Reviewed in the United States January 8, 2022",AFGVZQKAWGWPEPQJ7JFVHW4J6PKA,1,0,Unknown,HTC True Wireless Bluetooth Earbuds 2
222,RDTN05Q6I3Y0U,B09H27SXHS,5.0 out of 5 stars Affordable and good quality,Ale Fernandez,5,Very good quality sound and battery lasts.,"Reviewed in the United States February 27, 2022",AF4GHVDIITO7PGACOEZKXJEAJSMA,1,0,Unknown,HTC True Wireless Bluetooth Earbuds 2
223,R2MFQH0IECOMLN,B09H27SXHS,1.0 out of 5 stars I tried HARD but couldn't anymore,Speak the Truth,1,"Today was the day to update this review. I bought these headphones on the 21st of November. Unfortunately, I had a funeral for the right ear today becasue it just stopped working. The headsets once had clarity and people had no issues hearing me. However, they are still hard on the ears because they don't seem to fit well and my ears hurt at the end of the day.","Reviewed in the United States December 1, 2021",AFYWCKUG7JMJWK4YZ6P5MESGL27Q,1,1,Unknown,HTC True Wireless Bluetooth Earbuds 2
224,R18WSUC990D3CB,B09H27SXHS,1.0 out of 5 stars Unuasable,Kasey,1,"They only worked for maybe a full week. Now they will connect to my phone, but after maybe 3 minutes, one of the buds will disconnect and get stuck in a connection cycle. Tried to delete and resync them several times but it never fixes both buds, only 1 each time. Spend money on quality guys.","Reviewed in the United States March 2, 2022",AGJHNNWANYDT4HL46GVLJPM3GFUQ,1,0,Unknown,HTC True Wireless Bluetooth Earbuds 2
225,R2ARBIY1TG0XY,B09H27SXHS,5.0 out of 5 stars Very nice for the money,Billy,5,My teenage daughter loves them !,"Reviewed in the United States January 12, 2022",AFG6HSZUNL4L5WDWJ6ZPHRF6R7NQ,1,0,Unknown,HTC True Wireless Bluetooth Earbuds 2
226,R2YNZE2627GVH1,B09H27SXHS,5.0 out of 5 stars Really good for money.,Igor D.,5,Good battery. Easy to use.,"Reviewed in the United States December 27, 2021",AFKVMXRJMQ2E6GT2G7VTP7QRAC6A,1,0,Unknown,HTC True Wireless Bluetooth Earbuds 2
227,R1JS5ZGO5ZOEAC,B09H27SXHS,5.0 out of 5 stars Great product higly recommended,Amazon Customer,5,Great product highly recommended.,"Reviewed in the United States January 10, 2022",AEWUK5FXPXLKSZW6PRPXCZ7BJYXQ,1,0,Unknown,HTC True Wireless Bluetooth Earbuds 2
228,R4VF26FOVKFOG,B09H27SXHS,2.0 out of 5 stars They gets disconnected it when you are talking,Gerardo Ruiz,2,They gets disconnected it when you are talking,"Reviewed in the United States April 5, 2022",AFS7G3O2MLGE3MEJVKVWZ6XUFP4Q,1,0,Unknown,HTC True Wireless Bluetooth Earbuds 2
229,REM9QVBZCE21O,B09H27SXHS,2.0 out of 5 stars Comfy,ohene amankwah,2,No comfortable,"Reviewed in the United States May 22, 2022",AFIYDQFCKGQ6R4DUJIOP26JV7EUQ,1,0,Unknown,HTC True Wireless Bluetooth Earbuds 2
230,R13CI1S6EU75A,B09H27SXHS,1.0 out of 5 stars Theyre not that good,Britt,1,"They're good headphones, until one falls out of your ear then that headphone will not work. I cant hear anything out of my left earbud, but my right earbud still works and has fallen out as well. The sound is nice, but I wouldnt recommend.","Reviewed in the United States April 28, 2022",AEOPP2ECDRMN7DKG66ZJKJGZKOJA,1,0,Unknown,HTC True Wireless Bluetooth Earbuds 2
231,R2HQY07AMLC15S,B09H27SXHS,1.0 out of 5 stars Sound volume too low and always disconnect,Tonny,1,"Purchased in Black Friday 2021, sound volume too low and the battery of one of the earplug goes very quickly and disconnected within an hour, and then it plays annoying bee bee sound when it is disconnected and looking for a device.","Reviewed in the United States June 23, 2022",AF3GGXUKR6KSMZQSDC5YCL4UCH5Q,1,0,Unknown,HTC True Wireless Bluetooth Earbuds 2
232,R3LODIHI2ZVG4G,B09H27SXHS,1.0 out of 5 stars Ear size,Garfield thompson,1,I returned it as none of the ear sizes worked property and stayed in place. When you moved at a slight pace it would fall out. It was only good if you were sitting down or stationary,"Reviewed in the United States July 20, 2022",AGJUZFX2N3RPTUP7QHZOQW7K5A4A,1,0,Unknown,HTC True Wireless Bluetooth Earbuds 2
233,R2KC32QWMPJUL5,B09H27SXHS,1.0 out of 5 stars Audio quit working on 1 unit,Danny McDonald,1,I've only had these for 2 months and only used them 5 or 6 times and one no longer has audio. I know its connecting because the touch pad works for volume but there is no audio.,"Reviewed in the United States April 29, 2022",AFNACEMRBSKXAPGR7L7UIWEOXHZA,1,0,Unknown,HTC True Wireless Bluetooth Earbuds 2
234,R2352PYL92XBP,B09H27SXHS,1.0 out of 5 stars The right ear bud stopped working after a week of owning/using.,Hunter Lamer,1,I liked them until one of the two stopped working after a week of use. Update: second one failed a week after the first one. Wish I could get my money back.,"Reviewed in the United States March 19, 2022",AFQLYR47P7AU2JRVUM2ED5ZSIZUQ,1,0,Unknown,HTC True Wireless Bluetooth Earbuds 2
235,R1DKW21Y9EB0Y6,B09H27SXHS,1.0 out of 5 stars Defective item,Nwanne,1,Charging case does not hold a charge. Once it's unplugged the LED turns red meaning it needs to be charged. I have been charging it since last night. I will be returning this item.,"Reviewed in the United States May 3, 2022",AHFHB4R2AIDA26BD2HU263QEOBQA,1,0,Unknown,HTC True Wireless Bluetooth Earbuds 2
236,R2A62ZZHN1VHTE,B09H27SXHS,1.0 out of 5 stars Didn’t last more than one use,Kimberly D.,1,"Charged ear buds, use them for the first time & then they didn’t work. I followed the reset directions & now only one side works. Poor quality.","Reviewed in the United States June 29, 2022",AF2LSBJH3QMUBOQHDEXVHKPKVJZQ,1,0,Unknown,HTC True Wireless Bluetooth Earbuds 2
237,RXYNYT9L6I7MZ,B09H27SXHS,1.0 out of 5 stars Never recharged,Mr. Smith,1,It worked great the first day I got them. I left it on charger for awhile and the case was charged up but it never charged the earbuds. Waste of earbuds,"Reviewed in the United States January 29, 2022",AFRM7VSIBK7NHCS2VYIK5SG42YFQ,1,0,Unknown,HTC True Wireless Bluetooth Earbuds 2
238,RU1AT569TQ1I4,B09H27SXHS,1.0 out of 5 stars This is thing is a waste of money do not buy it,Didi,1,This HTC ear bud is the worst thing ever all it does is beep I put it in the trash the next day. Very useless thing to waste money on.,"Reviewed in the United States January 22, 2022",AEKYUOQK5CSWRQFEVELCNKHG37TQ,1,1,Unknown,HTC True Wireless Bluetooth Earbuds 2
239,R2STNPDXKV81AW,B09H27SXHS,1.0 out of 5 stars Right ear bud stopped working after 1 month.,Amazon Customer,1,I had this for less than a month before one stopped playing. it still controls playback (stop/start) but there is no sound.,"Reviewed in the United States March 13, 2022",AEWANB2HXJK6FD64OBM42WVOHQWA,1,0,Unknown,HTC True Wireless Bluetooth Earbuds 2
240,R1TSNYXEMWB9XA,B09H27SXHS,1.0 out of 5 stars Muy mala calidad,maximiliano Rodriguez,1,Muy mala calidad,"Reviewed in the United States June 26, 2022",AHSO7SSTO2EOVTNQWGOZ7BDKZFCA,1,0,Unknown,HTC True Wireless Bluetooth Earbuds 2
241,R1N8SGNE8GVRQ5,B09H27SXHS,1.0 out of 5 stars Waste of money,SP,1,"By the second time using them, the left side stopped working. Waste of money.","Reviewed in the United States September 22, 2022",AEKCV2HFAIG2YDDS5MPUG4YEIQRA,1,0,Unknown,HTC True Wireless Bluetooth Earbuds 2
242,R2GNZJDQQQE0XP,B09H27SXHS,1.0 out of 5 stars Worked for 3 days,Christian cardenas,1,Now they won't charge past 30%. I'm disappointed in them.,"Reviewed in the United States December 8, 2021",AGG4D4TYDX2I5PLYQVIL7FUUKOXQ,1,1,Unknown,HTC True Wireless Bluetooth Earbuds 2
243,RI0YHR3D2DSQ5,B09H27SXHS,1.0 out of 5 stars Don’t bother!!!,RV,1,Horrible! Would not pair correctly. It would connect with out sound. What good is that?!?! Waste of money!!,"Reviewed in the United States June 14, 2022",AG57WRWWER3MKRCVS3CVQXUXRFFA,1,0,Unknown,HTC True Wireless Bluetooth Earbuds 2
244,R2GKIRLTD7YY0I,B09H27SXHS,1.0 out of 5 stars Do not buy lasted a few months the. Stopped working,Eric,1,Garbage product,"Reviewed in the United States May 24, 2022",AEEWZIJREFG534J7GROPTZZORAGA,1,0,Unknown,HTC True Wireless Bluetooth Earbuds 2
245,R1TNTONRLTPEWR,B09FM6PDHP,5.0 out of 5 stars Raycons better up their game if they wanna compete.,Dawson,5,Before I bought these I had raycons. Raycon earbuds are absolute trash. The feel was cheap and they broke after dropping them. The sound was eh but absolute trash. I had to use the warranty to get a new pair and same issue. I had to eventually buy a new pair and I decided I wouldn't ever buy raycons again and since these were on sale for $60 I decided to give them a shot. I knew JBL was a great speaker and headphones brand so I wanted to give them a try. Omg they are the best earbuds I've ever had. They're so easy to connect to ur phone and you can change the sound profile from the app. The sound cancellation is like nothing I've ever had even better somehow than my gaming headphones I think. The bass is unreal!!! The sound clarity and everything is incredible. Best earbuds I've ever had. They are durable too. They feel like good quality and the case is perfect. It feels good it snaps shut and has a good satisfying feel and sound when it does. It fits perfectly in my pocket and the charge life is so fricken long I can go a week without charging it and it still has life. I've had these for about a month and only charged them maybe twice. I'm so happy with the way these are id highly suggest buying these. Especially over raycon earbuds. I'm so happy I helped people not waste their money on that crappy brand. Someone I talked to even canceled their order to buy a pair of these and thanked me because these were on sale for way cheaper. But even at base price for only a few dollars more why not buy quality? If you want the best earbuds I'd say on the market ....buy these. It's cheap for the experience and quality your getting.,"Reviewed in the United States May 16, 2024",AGI3WTFII3HB6JI2GL5PM7J7F7DQ,1,54,Color: BlackStyle: Headphones,JBL Tune 230NC TWS
246,R11OSJ184YK5L8,B09FM6PDHP,5.0 out of 5 stars Amazing sound quality,Amazon Customer,5,"This review is representative of my first impressions after receiving the item.Fit - 4/5: While I've had better fitting earbuds in the past, I would say that these aren't problematic at all, but not perfect either. The buds fit fairly snugly in my ears, and its quite nice that they've included a few tips. They don't seem to move around if I shake my head, so I have decent confidence that if I take them to the gym or on a run, I wouldn't have problems. That said, they don't quite fit perfectly, but everyones ear is a bit different so others might find it better or worse.Sound - 5/5: All I can say is wow do I love the sound that these produce. The level of bass is far beyond anything that I've had from my other earbuds (Jabra Elite 65t and Jlabs JBuds Air). The app includes equalizer settings that actually make quite a lot of difference (unlike other headphone apps I have used) and I am blown away by how much bass can come from these headphones. I have also noticed with other wireless buds that they tend to be on the quiet side, not reaching the same volume that my larger Sony headphones can, but that is not at all the case here. These get LOUD. As someone who plans to mainly use these for workouts, this is exactly what I hoped for.Battery - 5/5: So far I have not had a chance to use these until they die, so I have to disclaim that. However, if the battery matches up or comes close to their claims, which I expect they will given it is a reputable brand, then I will be impressed. My other buds max out at around 8 hours, so getting almost 4x the total battery life is excellent. 8 hours without recharging is very impressive.Look and feel - 3/5: The case looks nice and I think the aesthetics are fine. But the buds themselves are polished smooth, which makes them a bit tricky to handle with your fingertips. Once they're in, its no problem. But a matte finish or some texture would have been better for usability.I'll update this review if I find any reason to, but I am extremely impressed by the headphones, especially for the price point. Highly recommend!","Reviewed in the United States July 19, 2024",AHDFGIHZLAWNS6GVEJFT6HO4JONQ,1,18,Color: BlackStyle: Headphones,JBL Tune 230NC TWS
247,R2ND8UB3QKR4XD,B09FM6PDHP,4.0 out of 5 stars JBL for the win.,Amber,4,"Affordable, and great all arounder. Noise cancelling is great, they fit in my ears well which I usually have trouble with. The quick start guide helped a ton figuring out all the controls, which is a must for me as I find I have a lot trouble figuring these types of things out. I think there is even an app that you can change the commands which is pretty cool! So they get an A plus for adjustability in that regard.I love the color, I chose navy but there many to choose from. I haven’t used them much for phone calls yet, but they pick up the wind a lot so I’ve chosen not to use them for most of my phone calls when I’ve had them in.","Reviewed in the United States July 29, 2024",AHKSTPYCQ256XNBIJJNN5IKNF43A,1,1,Color: BlueStyle: Headphones,JBL Tune 230NC TWS
248,R1ATLW9X08QUD0,B09FM6PDHP,"5.0 out of 5 stars Great sound, comfortable in the ears",Rusty Squeezebox,5,"Took a chance and bought these on prime day, pleasantly surprised with the quality compared to the jlab buds I've been using for years. Again very happy with the quality but more importantly for me is the battery life, these are very comparable with the higher end jlab buds that will last me the entire work day and have enough juice in the case so that I'm not having to charge them multiple times a week. These are amazing in both categories. And lastly you can listen to each bud independently which is a must for people like me that usually only wear one. So In the off chance one dies you just pop in the other one and your good to go for another 8 hours.","Reviewed in the United States July 25, 2024",AGYXE4BIFF7ICA2CNQ27K5VYPBCQ,1,0,Color: BlackStyle: Headphones,JBL Tune 230NC TWS
